words_en,ratings
You always leave your stuff lying around,bad
You always lose everything.,bad
You always lose the keys,bad
You always lose your temper in these cases,bad
You always make this so hard!,bad
You always need to be the center of attention,violent
You always need to make lists for everything,bad
You always piss me off,violent
You always plan everything unnecessarily,bad
You always put the blame on me.,violent
You always repeat the same mistakes,bad
You always say that.,bad
You always say the same thing,bad
"You always say very hurtful things to me, you realize that at some point...",violent
You always see the bad side of things,violent
You always seem to ignore others,bad
You always spend all our money,bad
You always take her side,bad
You always take my toys.,bad
You always try to put me down.,violent
You always want me to answer you in the minute,violent
You always want to be right,violent
You always want to change everything,bad
You always want to decide everything,violent
You always want to have the last word,violent
You always want to put your needs before mine.,violent
You always want to think for me,violent
You always yell at me,violent
You and I are the same,bad
"You and me, we're not meant to get along",bad
you are a baby,very violent
you are a bad football player. ,very violent
You are a bad husband,very violent
You are a bad person,very violent
You are a bad wife,very violent
you are a bastard,very violent
You are a beast,bad
You are a beast,violent
You are a big cock.,violent
You are a big fat liar,violent
You are a big lazy person.,violent
you are a bigot,very violent
you are a bit limited,very violent
you are a bit of a wuss,very violent
"You are a bit slow, aren't you?",very violent
You are a bit stubborn...,violent
you are a bit tense,violent
you are a bitch,very violent
You are a bitter old man who only knows how to hurt others.,violent
you are a bludger,very violent
You are a bore...,very violent
You are a born victim,very violent
you are a burden,very violent
you are a co-dependent,very violent
You are a cold and insensitive man,violent
You are a common thief,violent
you are a coward,very violent
you are a criminal,very violent
You are a dangerous madman.,violent
You are a disaster,very violent
you are a disgrace,very violent
You are a dreamer,violent
You are a failure,very violent
You are a failure,very violent
"You are a ficking bastard, aren't you?",very violent
You are a fool,violent
You are a fraud.,violent
You are a frustrated pervert.,violent
You are a fucking retard.,very violent
You are a good little mutt who always follows his master's orders.,very violent
You are a harpy,very violent
you are a hateful person,very violent
You are a hateful person,very violent
you are a helpless baby,very violent
You are a horrible person,very violent
You are a jealous person,violent
you are a junky,very violent
You are a lazy man,violent
You are a lazy person,very violent
you are a liar,violent
You are a lie,very violent
You are a little street rat,very violent
You are a little too organized,bad
you are a lonner,bad
you are a looker,violent
You are a looney maniac...,very violent
you are a loser,very violent
you are a lousy kisser,violent
you are a low life,very violent
You are a mess,very violent
you are a mess,very violent
you are a monster,very violent
You are a monster,very violent
you are a nightmare,very violent
you are a nitwit,very violent
you are a pain in the ass,very violent
you are a pain in the ass,very violent
You are a phantasmagorical indignity,bad
You are a piece of shit...,very violent
You are a pompous baby!,very violent
you are a real addict,bad
You are a real ball of nerves,bad
You are a real horror all by yourself.,very violent
you are a ruminator,bad
you are a seeksorrow,violent
you are a self-harmer,bad
you are a spoiled child who throws a tantrum any time he doesn't get what he wants!,very violent
You are a submissive,very violent
you are a Talkaholic,bad
you are a thief,very violent
you are a traitor,very violent
"You are a valued member of our team, and I truly appreciate your contributions!",acceptable positive
you are a victim,very violent
You are a villain trying to lure me into an ambush!,violent
you are a witch,very violent
You are a witch,very violent
You are a wreck,very violent
You are abandoning me for your work.,bad
you are always angry,violent
You are always busy. ,bad
you are always depressed,bad
You are always feeling blue,bad
You are always in the moonlight,bad
You are always jealous,bad
you are always late,bad
"You are always nervous, what do you want me to say?",bad
you are always right,bad
You are always scary when you get mad,bad
You are always stuck on your ideas and it takes you forever to realize that they can't work.,violent
You are always uncomfortable in public,bad
You are always upset,violent
You are always worried.,bad
You are an aggressive person.,violent
You are an evil little boy,very violent
you are an idiot,very violent
You are an ingrate.,very violent
You are an insecure person,bad
You are an inspiration for the team and you have a significant role to play in the future success of the organisation.,good
You are an irresponsible person who never finishes his tasks,violent
You are an unfeeling wretch who has no discernment over good and evil,very violent
You are an ungrateful person.,very violent
You are and will remain a fool.,very violent
You are angry with the whole world!,violent
You are annoying me on purpose.,bad
You are arrogant,violent
you are ashamed of me,bad
You are bad at abstraction,bad
You are bad.,very violent
You are badly organized,bad
You are becoming completely hysterical,very violent
You are being too generous to people who don't deserve it.,bad
You are being unkind to them.,bad
you are careless,very violent
You are clearly loosing your mind moron...,very violent
You are clearly not interested in other poeple's problems,bad
You are clearly not the life of the party,bad
you are clumsy,bad
You are completely bipolar,violent
you are completely crazy,very violent
You are completely delusional,violent
You are completely hysterical,violent
You are completely lost...,violent
You are completely neurotic,violent
You are completely obsessed with sodomy.,bad
You are completely rigid,violent
You are completely scattered,bad
You are completely unstable,violent
You are completely untidy,bad
"You are connected to this person, right?",good
you are contemptuous,very violent
You are crazy,violent
You are crazy,violent
you are crazy,very violent
You are dangerous to society.,very violent
"You are delusional, absolutely nothing like this has ever happened.",violent
You are destroying our relationship,violent
You are digusting.,bad
You are disgusting and I despise you.,very violent
you are dishonest,violent
You are disorganized,bad
You are disrespectful,violent
You are doing this on purpose to irritate me...,bad
you are egocentric,very violent
You are emotionally unavailable to me,bad
You are emotionally unstable,very violent
You are exaggerating,bad
"You are facing a difficult reality and you need support, is that it?",good
You are far too gullible.,bad
You are frankly very boring,violent
You are full of flaws.,very violent
you are going mad,violent
You are going to fall.,bad
You are going to leave me.,bad
you are going to see what wood I heat myself with,very violent
you are grubby,very violent
"You are having difficulties and you would like to be listened to, right?",good
you are helpless,violent
you are horrible,very violent
You are horrible,very violent
you are horrible to me,very violent
You are hostile and unpleasant to others.,very violent
You are hurtful,bad
You are hyper active,bad
you are ignoring me,bad
you are impertinent,bad
you are impossible,bad
You are impressionable,violent
You are in a terrible state,very violent
You are in an indescribable anger,bad
You are incapable,very violent
You are incredibly pretentious,violent
You are infuriating.,violent
You are inhuman,very violent
You are insane...,very violent
you are insignificant,very violent
You are interested in too many useless things,bad
You are just a Bible thumper moron...,very violent
You are just a charlatan,very violent
You are just a dreamer,violent
You are just a junkie...,very violent
You are just a lunatic fool...,very violent
You are just a piece of trash,very violent
You are just a puppet,very violent
You are just a slanderer!,very violent
You are just a weakling,very violent
You are just a wizard,very violent
You are just an amateur,very violent
You are just an old coward,very violent
You are just another bad dream,very violent
You are just another hysterical woman...,very violent
You are just another white man,very violent
You are just collateral damage,very violent
You are just crap,very violent
You are lazy,violent
you are lazy,very violent
you are living beyond your means,bad
You are looking for conflict,bad
you are lucky to have me,violent
you are malopoli,very violent
You are manipulating me.,violent
you are mean,violent
you are mean,very violent
you are messy,violent
You are misbehaving,violent
You are murderers,violent
You are my beloved one.,good
You are my best friend,acceptable positive
You are my soul mate.,acceptable positive
you are never happy,violent
You are never prepared,violent
You are never relaxed,violent
You are no longuer attracting,very violent
You are no match for me,bad
You are not a competent person,very violent
You are not a good employee,very violent
You are not a good husband,violent
You are not a good listener,bad
You are not a good person,violent
You are not aggressive enough to succeed in business.,violent
You are not an interesting person,very violent
You are not as brave as you say.,bad
You are not at all interested in others,violent
You are not attractive,violent
You are not aware of what it means,bad
You are not creative,violent
You are not exactly exacting in your work,violent
You are not flexible enough.,violent
You are not good at what you do,violent
You are not interested in me,bad
You are not interested in people,bad
You are not interested in this,bad
you are not involved,bad
you are not like you used to be,bad
You are not motivated,bad
You are not orderly,bad
you are not precise enough,bad
you are not qualified,bad
You are not quiet enough,bad
You are not right in the head,violent
you are not the person I met,violent
you are not the person I met anymore,violent
You are not trustworthy,violent
you are not up to it,very violent
you are not very gifted,very violent
you are not very smart,very violent
You are nothing,very violent
You are nothing but a traitor,violent
You are nothing without me,very violent
You are obsessed with planning everything,bad
You are obsessed with revenge,violent
You are of a lower level than me,very violent
You are only a one clown.,very violent
You are only an employee.,violent
You are only one waste of the company,very violent
You are paranoid,violent
you are persecuting me,violent
You are pigs who make everything dirty.,violent
You are quite possibly a clinical sociopath.,very violent
you are racist,violent
you are really bad,very violent
You are really heavy!,violent
You are really tiring,violent
You are really too suspicious...,violent
You are really weird,very violent
You are resentful of others.,very violent
You are scraring me.,bad
you are selfish,violent
you are silly,very violent
you are slow to learn,very violent
You are so bossy.,violent
You are so clingy,very violent
You are so cute!,good
You are so insignificant that I had already forgotten your miserable existence,very violent
You are so psychotic.,very violent
You are so self-righteous telling me I’m inconsiderate.,violent
You are so shy...,bad
You are so stupid.,very violent
you are social,very violent
"You are still disgruntled, as usual.",violent
You are stubborn,violent
you are stupid,very violent
you are stupid,very violent
You are such a ball of nerves,bad
You are such a bigot.,violent
You are such a dork!,very violent
You are such a jerk!,very violent
You are such a lying bastard,very violent
You are such a manipulative person...,violent
You are such a stupid cunt,very violent
You are such an animal,violent
You are the dumbest person in the world,very violent
You are the king of the wankers.,very violent
You are the last of the idiots,very violent
you are the last of the jerks,very violent
You are the most arrogant person I have ever listened to,very violent
You are the most important thing in the world to me.,good
You are the most self-centered person I’ve ever met.,very violent
You are the most selfish person I have ever known.,very violent
You are the one who is selfish.,violent
you are the silliest old tart.,violent
You are the strangest person I've ever met,violent
You are the worst,very violent
you are the worst kind of kassos,very violent
"You are to quiet, it is boring.",violent
You are too absent-minded for me to trust you.,violent
You are too afraid to be the center of attention,violent
you are too aggressive,bad
You are too avoidant,bad
You are too closed,bad
You are too conservative,bad
You are too crabby.,bad
You are too distracted,bad
You are too easily disturbed,bad
You are too easily influenced,bad
you are too emotional,bad
You are too emotional,bad
You are too emotional,bad
You are too fearful for a night trip with us.,violent
You are too feverish to be taken seriously.,violent
You are too fragile to survive without me in this world.,violent
You are too generous,bad
You are too incompetent for me to let you do it.,very violent
"You are too indecisive, you need to learn to choose faster.",bad
You are too inflexible,bad
You are too introverted,bad
You are too jealous,bad
You are too melancholic.,bad
You are too much attracted by abstract ideas,bad
you are too much like this,bad
you are too negative,bad
You are too outgoing,bad
You are too potty,bad
You are too quick to anger,bad
You are too rigid.,bad
You are too sensitive,bad
You are too sensitive.,bad
you are too shy,bad
You are too skeptical.,bad
You are too suspicious.,bad
You are too tense when you speak in public,bad
"You are too tense, calm down.",bad
You are too weak,bad
You are too weak,very violent
You are totally boring,very violent
You are totally incapable of doing anything on your own.,very violent
You are totally inconsistent,very violent
You are totally unmanageable,violent
You are truly an inspiration to the team and definitely an important role in the company.,good
You are trying to provoke me,bad
You are trying to trap me with your schemes,bad
you are ugly. ,very violent
You are unable to listen to others.,violent
You are unable to park without damaging the car!,violent
You are unable to perceive the suffering of others,violent
You are unable to prove it with actions.,violent
you are unable to question yourself,violent
You are unable to think for yourself,very violent
you are unable to understand me,violent
You are unbearable,very violent
You are unbearably pretentious.,violent
You are unbelievably lazy.,violent
you are unfair to me,bad
You are unmanageable,very violent
You are unpredictable.,violent
You are unreasonable,bad
you are useless,very violent
You are using me.,bad
You are very aggressive and likes to start arguments.,violent
You are very emotional,bad
You are very messy,bad
"You are very talkative, aren't you?",bad
you are wasting our time,violent
You are way too flexible,bad
you are weak,very violent
You are wearing me out.,bad
you are whore,very violent
you are worthless,very violent
You are wrong,bad
You aren’t God!,violent
you arrive late several times a week,good
You arrived at 10:00 this morning,good
You ask yourself too many existential questions,bad
You asked me to look for your notebook but I can't find it,good
You asked me to make a pie but there is no more pie dough,good
You asked to have another hamburger.,good
You assault me,bad
You asshole...,very violent
You attack me again,bad
you avoid discussions,bad
you avoid me,bad
You baltringue...,very violent
You behave badly,violent
You behave like a banker with us,violent
You behave like a fragile little animal,very violent
You behave like a fury.,violent
You behave like a spoiled child,violent
you behave like you want to break up,bad
You behaved badly with him.,bad
you believe in it too much,very violent
You betray me.,bad
You betrayed me.,bad
You better do this,bad
You better stop hanging around,very violent
you big unbalance,very violent
You bore me with your insipid conversation.,very violent
You bought 100 packages,good
You bought 20Kg of pasta,good
You brain damaged idiot...,very violent
You break my balls,very violent
You break my balls,very violent
You broke all the rules,bad
you broke everything,bad
You brush your teeth twice a day.,good
You bully me,bad
"You called this person you don't know ""buddy",good
You calm down!,violent
You came home at midnight I didn't know where you were and I was worried.,good
you can always run,violent
you can always try,violent
You can always try to look smart,very violent
You can be a pain in the ass like you are,violent
You can be so absent-minded...,bad
You can be such a pain in the ass...,violent
you can die,very violent
You can die!,very violent
You can look like a fool...,violent
You can never be trusted,violent
You can see that you are unable to control yourself,violent
you can stay by yourself,violent
You cannot understand abstract ideas,bad
You can't anticipate,violent
You can't be trusted,violent
You can't come up to my level,violent
"You can't compare yourself to me, I'm on a completely different level than you",very violent
You can't cook,bad
You can't do anything,very violent
You can't do anything on your own,violent
you can't do it,bad
you can't do it,bad
You can't do this,violent
You can't even do that,bad
You can't even do that,violent
You can't even understand me,violent
You can't even vacuum,violent
You can't explain things properly,bad
You can't fight me,violent
You can't handle the situation,violent
You can't handle this kind of situation.,violent
You can't help but be suspicious of everyone?,violent
You can't improvise,bad
You can't keep a straight face,bad
You can't keep getting angry over nothing like that,violent
You can't learn that from books,bad
you can't make it,bad
you can't make me feel guilty,violent
You can't plan properly,violent
You can't possibly be that stupid...,very violent
You can't stand being loved.,violent
You can't stay calm,violent
You can't think for yourself,very violent
You can't think for yourself.,very violent
You can't understand,bad
you can't understand,bad
You can't understand how important it is to me,bad
You can't understand me.,bad
You can't win against me,violent
You can't work,violent
You care too much about others,bad
You change moods all the time,violent
You change your mind all the time,bad
You change your mind like your shirt,bad
You change your mood too often,bad
You cheated in the last poker game,good
You cheated me.,bad
You clearly are a dependant person.,violent
You clearly have a problem,violent
You comical picture of misery.,very violent
You consider me undesirable,violent
You contradicted our friend yesterday,good
You could at least pretend to care!,violent
You could get off your ass I'm not the housekeeper,violent
You could make an effort,violent
You cry over nothing,violent
You cry too much,violent
You defective piece of trash...,very violent
You deserve a bad grade,violent
You deserve a punch in the face,very violent
You deserve that I break your neck,very violent
You deserve to be in jail,violent
You deserve to be punished,very violent
You deserve to be punished for what you did,very violent
You deserve to be put away,very violent
you deserve to be shat on,very violent
You deserve to be slapped,very violent
You deserve to be slapped,very violent
You deserve to be slapped,very violent
You deserve to be slapped...,very violent
you deserved it,very violent
You despise me,violent
You destroy everyone's life,very violent
You did not only achieve your goals within the given deadline but also set a great example of accurate goal-setting and efficient output.,good
you did this to piss me off,violent
You didn't contradict our friend when he was wrong,good
You didn't even mention me,bad
You didn't even realize,bad
You didn't give me enough love.,violent
You didn't help me to tidy the house,good
You didn't learn anything from the last time,bad
You didn't learn from it,bad
You dirty pawn of American imperialism!,very violent
You dirty vermin...,very violent
You disappointed me by not coming last night.,bad
You disgust everyone with your snot hanging from your nose.,violent
You disgust me,violent
you disgust me,very violent
You dislike me too much to listen to me for even a second...,bad
You disrespect everyone,bad
You do a bad job,violent
You do everything wrong.,violent
You do everything you can not to attract attention,violent
You do everything you can to make me mad,violent
you do it on purpose,violent
"You do things the way you're told to do them, period.",bad
You do this because you know it will make me angry and because you like to provoke me...,violent
you do too much,bad
You do what I say,bad
you do what I tell you to do,very violent
You do what you want without consulting others,bad
You don’t love me.,bad
you don't accept me,bad
You don't appear to have excellent ideas,very violent
You don't appreciate me,bad
You don't appreciate me for what I am.,bad
you don't care,bad
You don't care about anyone around you.,violent
You don't care about anything,violent
you don't care about anything,very violent
You don't care about me,violent
you don't care about me anymore,violent
"You don't care about me, admit it.",violent
You don't care about my feelings,bad
You don't care about my friends,bad
you don't care about my gifts,violent
You don't care about others,violent
You don't care about the truth,violent
You don't care enough,bad
"You don't care if the living room is ugly and old, you have no taste anyway.",violent
You don't deserve any attention,very violent
You don't deserve anything,very violent
You don't deserve everything I do for you,very violent
You don't deserve me,very violent
You don't deserve my interest,very violent
You don't deserve to be cared about.,very violent
You don't do anything,violent
you don't even comfort me,bad
You don't even know how to turn on a washing machine.,bad
You don't even know what you want,bad
you don't even realize it anymore,violent
You don't even see me,violent
You don't even try to understand me,violent
You don't even understand the basics,violent
You don't explain well,bad
You don't feel confortable with me,bad
You don't feel other people emotions,bad
You don't get chores done right away,bad
You don't get it,very violent
You don't get it...,violent
You don't give a damn,violent
you don't give a fuck anymore,violent
you don't give a shit about me,violent
You don't give me any freedom,violent
You don't have a hair in your hand by any chance?,violent
you don't have confidence in yourself,bad
You don't have such a good imagination,bad
You don't have the capacity to understand,very violent
you don't have the intelligence,very violent
You don't have the reasoning ability to generate relevant ideas.,very violent
"You don't have the right mind to talk to me, go calm down somewhere else.",violent
You don't have the right mindset to grow in this company.,very violent
you don't have the right priorities,bad
you don't have the skills,violent
You don't have the skills that I have.,very violent
You don't have the skills to judge it,violent
you don't have time to deal with it,bad
you don't have time to waste on it,bad
You don't have to worry about the things you can't do anything about.,bad
you don't have to yell,bad
You don't hear me when I talk to you.,bad
You don't know anything,bad
You don't know anything about me,violent
You don't know how to control your anger.,bad
You don't know how to control yourself.,violent
You don't know how to deal with me,violent
You don't know how to deal with people,bad
You don't know how to deal with stressful situations other than by getting angry,violent
You don't know how to deal with your emotions.,bad
You don't know how to do,bad
You don't know how to do it,bad
You don't know how to do it properly because you don't have the necessary experience.,bad
You don't know how to do the right thing,violent
You don't know how to follow a schedule,bad
You don't know how to handle it,bad
You don't know how to handle stressful situations,bad
You don't know how to handle this kind of situation,bad
You don't know how to learn properly,bad
You don't know how to leave people alone,bad
You don't know how to leave possibilities open,bad
You don't know how to make feel people at ease,bad
you don't know how to make yourself respected,bad
You don't know how to manage things,bad
You don't know how to manage your anger,bad
You don't know how to manage your priorities,bad
You don't know how to organize your time,bad
You don't know how to plan,bad
You don't know how to present yourself properly,bad
You don't know how to put your stuff away,bad
You don't know how to put your things away,bad
You don't know how to question yourself.,bad
