words_en,ratings
 I feel neglected by you.,bad
A big boy doesn't cry,bad
"A cheetah, the fastest land animal, can run 70 miles an hour.",good
A combination of words that makes a complete sense is called a sentence.,good
A door would have more charisma than you,very violent
A feeling of gratitude is born in me.,good
A group of words which makes a complete sense is called a sentence.,good
A little hello and kiss from our son,good
A nurse is ten times more likely to have chronic low back pain at age 40 than an office executive.,good
A piece of my heart is missing when you’re not with me.,good
"A stranger offered me a large sum of money for a small favor, I admit I feel suspicious.",good
"A trespasser, that's what you are.",very violent
"A variety of benefits were reported, including ""conversations and meetings were notably more efficient, with issues being resolved in 50-80 percent less time.",good
"A vibrating duck is a bath toy, right?",good
"About twenty years ago, our big game was to have sex at night in telephone booths.",good
Abstract art is crap for snobs.,violent
"According to the GPS, it will take us 1 hour to drive to our friends' house.",good
"According to this article, the volcanoes in Auvergne are not dangerous.",good
"According to Wikipedia, Paris is the capital of France.",good
"According to Wikipedia, potatoes are not vegetables.",good
"Act like you're shocked, Mr. Puritan.",bad
"Actually, I'm gay.",good
"Actually, you are a simple drunkard.",very violent
Admit your mistakes sometimes,bad
"After all of this time, I'm still so crazy for you.",good
"After all, you're nothing but a demon.",very violent
"After dinner, I make sure that everything is ready for the next day.",good
"After finished work, I go home.",good
"After she started to vomit, she realized the food she ate for lunch was expired.",good
After sleeping twelve hours I feel full of energy.,good
After the long hot night we spent together I feel exhausted.,good
"After the one-week survey completion deadline, we will evaluate all the data and give you the general results including any action being taken or additional materials.",good
After this dance I feel full of energy.,good
After this good news I feel in a happy mood.,excellent
"After this long talk, I am tired and need to recharge.",excellent
After this meal I feel full.,excellent
After this spa treatment I feel regenerated.,excellent
"After yesterday's argument, I feel defensive.",excellent
"After yesterday's events, I feel desperate.",excellent
Again your fucked up humor,violent
All bitches,very violent
All I ever want is to make you happy.,good
"All I want to do is spend my days being with you, laughing with you and adoring you.",good
All is well!,acceptable positive
all my exes are crazy,bad
all my exes are crazy,bad
All of A. R. Rahman's songs became hits.,acceptable positive
All of MIA's songs became popular around the world.,acceptable positive
All of my friends are paly cricket.,acceptable positive
All of our efforts were in vain.,bad
All of the cattle are dead in the disaster.,good
All of the dogs were alive.,good
All of the good in my life is because of you.,acceptable positive
All of the people are not dead.,good
All of them are brave.,acceptable positive
All of them are educated.,acceptable positive
All of them are intelligent.,acceptable positive
All of them are not poor.,good
All of them went out.,good
All of them went there.,good
All of us are fine.,good
All of us are learning English.,good
All of us are silent.,good
All of us are sinners.,bad
All of us learn from our failures.,acceptable positive
All of us want to live as long as possible.,acceptable positive
All of us want to live with peace.,acceptable positive
All of us watch online movies.,acceptable positive
All of us were silent.,good
All of you are babies.,violent
All of you are welcome.,good
All the best,good
All the important decisions in my life have been made by others.,bad
All the pots and pans are dirty,good
All these people are thieves,bad
"All these years of friendship, and you're nothing but a felon!",very violent
All this is perfectly laughable,bad
all this is useless,bad
All this is without interest,bad
all this will end badly,bad
All three laundry baskets are full,good
all you are is a cancer.,very violent
All you can do is using people and manipulate them!,violent
All you care about is being right,violent
All you care about is money,violent
All you do is cry,violent
All you do is fuck around,violent
All you do is get upset all the time,violent
All you do is goof around,violent
All you do is mistreat me.,very violent
All you do is play violent games.,bad
"All you do is think of yourself, you selfish slime!",very violent
All you know how to do is pout at me,violent
All you think about is having fun.,bad
"Also, I am interested in the project.",good
Always one step forward and two steps back...,violent
Always such a disappointing monster.,very violent
"Always, always and still angry, that's all you know how to do...",violent
Am I on the right track with this conversation?,good
Am I right in thinking that there is some need for creativity in this?,excellent
"America first, and fuck the others...",violent
And I really need some space because I’m in a lot of pain right now…,excellent
"And if I lay across your lap with my butt in the air, would you want to spank me?",good
"And my hand in your face, do you want it?",very violent
And my hand in your face?,very violent
"And suddenly, all the love songs were about you.",acceptable positive
And you can't even guess?,bad
Anonymisation results from processing personal data in order to irreversibly prevent identification,good
Anonymization and pseudonymization are not the same methods.,good
Anonymization is a technique that irreversibly alters data,good
Anyway I never find anything I understand,bad
anyway you don't understand anything,violent
Anyway you're always too tired for that,violent
"Anyway, it's your life.",bad
Arabic etymology considers that the word Arab derives from the verb to express,good
Arabs are all thieves,violent
Arabs are terrorists,violent
Are angels male or female?,good
Are any of the items nice-to-have?,good
Are search engines and subscribers receiving your content?,good
Are there aliens in the universe?,good
Are there any action games on facebook?,good
Are there any beaches in Bhutan?,good
Are there any black lions in the world?,good
Are there any fees?,good
Are there any free dating sites?,good
Are there any free movies on iPhone?,good
Are there any free movies on YouTube?,good
Are there any rules I should know about?,good
Are there any special events?,good
Are there any trillionaires in Japan?,good
Are there any trillionaires in the world?,good
Are there beaches in Nepal?,good
Are there bears in Scotland?,good
Are there black lions?,good
Are there calories in coffee?,good
Are there eagles in Hong Kong?,good
Are there eBay gift vouchers?,good
Are there elephants at London zoo?,good
Are there elephants in Sri Lanka?,good
Are there fish in the dead sea?,good
Are there flying spiders?,good
Are there ghosts in the world?,good
Are there great white sharks in Norway?,good
Are there gypsies in Canada?,good
Are there humans in other galaxies?,good
Are there hummingbirds in Japan?,good
Are there icebergs in lake Winnipeg?,good
Are there jaguars in the UK?,good
Are there jobs in the USA?,good
Are there kangaroos in Australia?,good
Are there kangaroos in New Zealand?,good
Are there koalas in Australia?,good
Are there legal steroids?,good
Are there lions in India?,good
Are there mermaids?,good
Are there mountains in California?,good
Are there multiple universes?,good
Are there nerves in bones?,good
Are there nuclear weapons in India?,good
Are there orphanages in the USA?,good
Are there other galaxies?,good
Are there other solar systems?,good
Are there other universes?,good
Are there penguins in Africa?,good
Are there poisonous fish in the ocean?,good
Are there polar bears in Alaska?,good
Are there prophets today?,good
Are there quite generators?,good
Are there real vampires?,good
Are there reviews on Pediatric doctors?,good
Are there sharks in Turkey?,good
Are there tigers in India?,good
Are there tigers in Thailand?,good
Are there underground cities in America?,good
Are there unforgivable sins?,good
Are there volcanoes in Japan?,good
Are there vultures in Sri Lanka?,good
Are there walruses in England?,good
Are there whales in gulf of Mexico?,good
Are there white butterflies?,good
Are there white elephants?,good
Are there white lions?,good
Are there white peacocks in Jaffna?,good
Are there white people in Africa?,good
Are there wild animals?,good
Are there wolves in California?,good
Are you a fool or a psycho?,very violent
Are you a parent?,good
Are you afraid to be punished if I say that?,good
Are you afraid to try?,good
Are you alone in bed?,good
Are you angry because you want respect and to be heard?,excellent
Are you angry because you would like my government to use its resources differently?,good
Are you available in the next days for a discussion?,excellent
Are you discouraged?,excellent
Are you even aware of your own stupidity?,very violent
Are you exhausted and want to get some rest?,excellent
Are you experiencing similar feelings to those I mentioned? Is there anything you like about what I said?,excellent
Are you feeling angry and wanting respect and to be heard?,excellent
Are you feeling bad because you’re needing some time alone?,excellent
Are you feeling frustrated?,excellent
Are you feeling hurt and needing to know that you are loved?,excellent
Are you feeling hurt because I said that?,excellent
Are you feeling hurt because you need more consideration for your preferences?,excellent
Are you feeling sad and wanting to be held?,excellent
Are you feeling sad because you need more calm?,good
Are you going to keep on shouting like that at the slightest annoyance?,violent
Are you going to the dance tonight?,good
Are you okay walking with me?,excellent
Are you okay with it?,excellent
Are you reacting like this because I did this?,good
Are you reacting to what I told you yesterday?,excellent
Are you saying that you feel hurt because you need your preferences to be better taken into account?,excellent
Are you serious?,bad
are you still licking your onion?,very violent
Are you stupid or what?,very violent
Are you sure you're in your right mind?,violent
Are you surprised to see this?,excellent
Are you telling me that you feel hurt because you need more consideration for your preferences?,excellent
Are you tired of accusing me?,violent
Are you upset?,good
Are you wanting me to help you?,good
Are you willing to take my hand?,excellent
Are you willing to tell me what you are feeling and needing right now instead of what you think I am?,excellent
Are you willing to turn around?,good
Are you with this person?,good
Are you worried about it?,excellent
Aren't you a lazy person?,violent
aren't you a liar?,very violent
Aren't you a little old-fashioned?,violent
Aren't you fussy?,violent
Aren't you tired of hanging around doing nothing?,violent
aren't you tired of playing the victim?,violent
Aren't you tired of playing the victim?,violent
As a doctor I took an oath to protect my patients.,good
"As a result of recent events, I feel overwhelmed.",good
"As always, you are full of aversions.",violent
"As I mentioned during our recent phone conversation, we have offered our Marketing Associate position to a different candidate. ",good
"As of 2017, fifteen master's theses and doctoral dissertations are known to have tested the model on sample sizes of 108 or smaller and generally have found the model to be effective.",good
"As part of my writing process, I began recording every detail.",good
"As time goes on, my love and admiration for you have increased tenfold.",good
asshole,very violent
asshole,very violent
asshole,very violent
At 3:00 pm I have afternoon tea with my colleagues.,good
At least I can look at myself in the mirror,very violent
"At lunch, you were eating and talking at the same time.",excellent
"At that moment, I realized that I felt much more peaceful.",excellent
"At that moment, I was in my thoughts",good
At the same time when you have two neurons it's hard to think,violent
At the same time you always ask me impossible things while I do what I can,bad
"At the same time, I want you to know how scared and horrible I feel, and how grateful I’d be if you’d leave without hurting me.",good
"At the zoo, I saw a striped zebra.",good
At this costume party I felt in an exuberant mood.,good
"At your age, there's no way you can understand what we're talking about.",bad
"At your age, you don't even know how to add, aren't you ashamed?",very violent
Atheists like you will burn in hell.,violent
"Baby, be mine.",acceptable positive
bastard,very violent
bastard,very violent
"Be careful, I fear that you could fall.",good
Be nice,bad
be positive,bad
Be quiet!,violent
because of you,bad
because of you I couldn't do it,bad
because of you I'm in pain,bad
because of you we're in trouble,bad
because of you we're never gonna make it,bad
Because you're nothing but a cheat.,violent
Beg my forgiveness,bad
Being with make anything feel possible.,acceptable positive
Being with you is like a dream come true.,good
"Being with you, talking with you and laughing with you, that’s what I adore most.",good
Best regards,good
Best wishes,good
Big dumbass,very violent
Bisexuality is when you like both men and women.,good
bitch,very violent
bitch,very violent
bitch,very violent
bitch,very violent
"Blowing roofs off buildings, knocking down many trees, and severing power lines, the storm caused extensive damage.",good
Both of them are in the room.,good
Brazil is in South America.,good
bullshit,very violent
But damn sometimes you can be boring,bad
But how slow can you be,violent
But in the end you're just a loser.,very violent
"But it's fucking midnight, do you think it's time to ask me that?",bad
But of course you would,bad
But put your stuff in the basket at the end!,bad
but seriously,bad
But seriously you deserve to be slapped for saying such bullshit...,very violent
But that's because you never listen to me,bad
"But the truth is, look, you're a teenager.",violent
But what possessed me to trust you?,bad
But what's with the makeup?,bad
"But you are a fake, and a cowardly one.",very violent
But you must promise me,bad
"But you, as we know, are an ignorant fellow.",very violent
But you're just a coward.,very violent
But you're just a teenager.,bad
Butter wasn't on the shopping list,good
Butterflies in my stomach flutter whenever I’m with you.,good
By train to do his job. ,good
Bye,good
Bye for now.,good
Bye!,good
"Bye, bye.",good
calm down,bad
Calm down,bad
Calm down now,bad
Can everyone hear my instructions?,good
Can I ask you if it is possible to illustrate this concept with a visual?,good
Can I ask you to be tactful when you talk to her?,good
Can I ask you to help me bring in the groceries when I come back from the store?,good
Can I ask you to listen to the music with headphones during the night?,good
Can I ask you to return the pot of salt that you borrowed from me last week?,good
Can I go to the cinema?,good
Can the manager hold the job for me?,good
Can we end this meeting?,good
Can we stop masturbating and do some serious work?,bad
Can we talk about this,good
Can we talk again when I feel calmer?,good
Can you agree that music rehearsals are during the day and not at night?,good
Can you breathe more slowly?,good
Can you explain to me again how to start the washing machine?,good
Can you explain to me why the multiplication of two numbers is commutative?,good
Can you give me a hug?,good
Can you give me a shoulder massage?,good
Can you hear yourself?,bad
Can you help?,good
Can you not take a joke?,bad
Can you pass me the salt?,good
Can you please give me a little more context on the situation here?,good
Can you please pick up your things?,good
Can you please put on a hat because I'm afraid you'll get sunstroke.,good
Can you please repeat that?,good
Can you please send me the file?,good
Can you repeat the word I am trying to get across to you?,good
"Can you send the report to me by Friday, please?",good
Can you stand still for ten seconds?,good
Can you take 3 steps back?,good
Can you tell me about yourself?,good
Can you tell me again what brand of kibble to buy for the dog?,good
Can you tell me again what I said in a few words?,good
Can you tell me if you are concerned by my sharing? What is your opinion about it?,good
can you tell me more about it?,good
Can you tell me the points that have impressed you in what I have just shared with you?,good
Can you tell me what is alive for me?,good
Can you tell me what you have left of my words?,good
Can you tell me what you heard me say?,good
Can you translate my words into actions?,good
Can you translate what is important to me?,good
Can you try to slow down your movements?,good
"Can you wait a moment, please?",good
Can't you admit you're wrong for once?,bad
Can't you behave normally?,bad
Can't you play tennis anymore?,good
Can't you read or something?,violent
Caught being a selfish brat and you're gloating!,violent
Cela vous aidera à mieux vous y prendre un peu moins mal.,bad
"Chapman Flack sees an overlap between what Rosenberg advocates and critical thinking, especially Bertrand Russell's formulation uniting kindness and clear thinking.",good
Check yourself before you speak.,violent
Check yourself sometime!,violent
"Cmon, stop making such a huge deal of things.",violent
College professor Steve Williams will review the scholarship applications.,good
Come and fight if you're a man,very violent
"Come on, I'll show you how to reach the G-spot.",good
Come right away or I'll hit you with a stick.,very violent
Congratulation on achieving the sales target of the month!,good
Connor and Wentworth (2012) examined the impact of 6-months of NVC training and coaching on 23 executives in a Fortune 100 corporation.,good
consider yourself happy,bad
Could we agree that it’s okay if I remind you about it if you do it again?,good
Could you help me prioritize the list below?,excellent
"Could you help me to bail the water, so that the boat doesn't sink...",excellent
Could you please talk in low voice in this room?,excellent
Could you point to a specific example?,excellent
Could you rephrase me?,excellent
Could you say hello to me,good
Could you share what led to this conclusion to help me understand your perspective?,excellent
Could you show me how to clean the vacuum cleaner because it is clogged?,excellent
Could you stop doing that?,excellent
Could you tell me again what I said?,excellent
Could you tell me again what's on your mind?,excellent
Could you tell me if there are any yogurts left in the fridge?,excellent
Could you tell me if there is any food left this week or if I should go shopping?,excellent
Could you to tell me what you heard me say?,excellent
Curiosity is an ugly flaw,bad
"Damn but at this rate we're going to run out of time, I don't have that much to do.",violent
"Damn it, pay attention to the gas, you always forget to fill it up.",violent
"Damn, but you're really stupid sometimes",violent
Dark thoughts were acting in my mind.,good
"Dead or alive, you're living trash!",very violent
Dear all,good
Dear Jim,good
Dear Madam,good
Dear Mr. Smith,good
Dear Sir or Madam,good
"Dear Sir,",good
Did I tell you how grateful I am that you are my partner?,good
Did I touch a nerve by bringing up this subject?,good
Did you hear when I asked you to take out the trash,good
Did you know that the moon was born from earth fragments?,good
Did you like the blowjob I gave you in the car?,good
Did you see it with your own eyes?,bad
Did you see the stupid face he has too...,very violent
Did you think you were in a pigsty?,violent
Did you work yesterday?,good
Didn't your mother ever teach you how to behave?,violent
Dinner is never ready on time,bad
Dinner was ready at 8pm.,good
Dinner was served late because I cleaned up the kitchen before,good
dirty bastard,very violent
Dirty bitch,very violent
Dirty bitch,very violent
dirty cunt,very violent
Dirty cunt,very violent
Do it faster.,violent
do it like this,bad
Do it normally,bad
Do my words resonate with you?,good
Do not hesitate to contact me if you need any assistance.,good
Do not hesitate to contact me if you need further assistance.,good
Do not shout in this room.,bad
do this,bad
Do this and I'll give you a shot,very violent
Do this and it will go wrong,violent
Do we still have that meeting after lunch?,good
Do you agree?,good
Do you answer the phone?,good
Do you anticipate sometimes or do you do everything at the last minute?,violent
Do you believe in fate?,good
Do you believe in ghosts?,good
Do you believe in Santa Claus?,violent
Do you borrow any books from your friend?,good
Do you buy a shirt?,good
Do you celebrate your birthday every year?,good
Do you deposit money in the bank?,good
Do you do sports?,good
Do you drink coffee?,good
Do you drive a car?,good
Do you drive to work?,good
Do you earn money from YouTube?,good
Do you eat fish?,good
Do you eat the skin of a mango?,good
Do you enjoy English songs?,good
Do you ever listen when I talk?,bad
Do you ever realize what you're doing?,violent
Do you ever think about it?,bad
Do you ever think about me?,bad
Do you exercise regularly?,good
Do you expect to see her any time soon?,good
Do you feel better now?,good
Do you feel distrust and the need to protect yourself when you’re involved in financial affairs with them?,good
Do you feel ginger?,good
Do you feel like everyone's laughing at you?,very violent
Do you feel similar to what I have shared with you? Do you find yourself in what I am expressing?,good
Do you feel the same?,good
Do you feel upset?,good
Do you follow a computer course?,good
Do you forget your purse?,good
Do you get paid early on bank holidays?,good
Do you get up early every day?,good
Do you go grocery shopping every week?,good
Do you go to market?,good
Do you have 2 brain cells or what?,violent
Do you have a desire to take some time to think about this topic? Do you have an answer for me?,good
Do you have a dog?,good
Do you have a minute?,good
Do you have any allergies to medication?,good
Do you have any idea how I can help you with this?,good
Do you have any question?,good
Do you have traveler’s insurance?,good
Do you hear what I hear?,good
Do you interested working in this company?,good
Do you know how many people would like to be in your place?,violent
Do you know how to do that?,good
Do you know how to operate the computer?,good
Do you know how to write in English?,good
Do you know if it is possible to calculate the probability of failure on this machine?,good
Do you know who can help me?,good
Do you know?,good
Do you learn anything in college?,good
Do you learn English?,good
Do you learn from your mistakes?,good
Do you like chocolate ice-cream?,good
Do you like coffee?,good
Do you like spaghetti?,good
Do you like to fly?,good
Do you like to tennis anymore?,good
Do you listen to News?,good
Do you love English?,good
Do you love me?,good
Do you love me?,good
Do you mind if I record this?,good
Do you need a visa for Canada?,good
Do you need anything from my side to prepare until then?,good
Do you need help?,good
Do you need me to detail how I arrived at this result?,good
Do you open presents on boxing day?,good
Do you play tennis?,good
Do you practice English at night?,good
Do you practice yoga?,good
Do you practice your religion?,good
Do you prefer a boy or girl?,good
Do you prefer a cat or dog?,good
Do you prefer a mac or PC?,good
Do you prefer a virgin?,good
Do you prefer black guys or white guys?,good
Do you prefer brunettes or blondes?,good
Do you prefer chocolate or strawberry ice cream?,good
Do you prefer Coke or Pepsi?,good
Do you prefer cute or hot?,good
Do you prefer day or night?,good
Do you prefer desktop or laptop?,good
Do you prefer dogs or cats?,good
Do you prefer drinking or smoking?,good
Do you prefer eating out?,good
Do you prefer e-books or real books?,good
Do you prefer English or Tamil?,good
Do you prefer executive business organization?,good
Do you prefer facebook or twitter?,good
Do you prefer fat or skinny?,good
Do you prefer fiction or non-fiction?,good
Do you prefer first person or third person?,good
Do you prefer friends who are intelligent or friends who are reliable?,good
Do you prefer girls with or without makeup?,good
Do you prefer girls without makeup?,good
Do you prefer Google or Yahoo?,good
Do you prefer horror film?,good
Do you prefer hot or cold weather?,good
Do you prefer individual team sports?,good
Do you prefer indoor or outdoor activities?,good
Do you prefer iPhone or android?,good
Do you prefer kisses hugs?,good
Do you prefer long vacation or short vacation?,good
Do you prefer love marriage or arranged marriage?,good
Do you prefer male or female boss?,good
Do you prefer male or female doctors?,good
Do you prefer Nikon or Canon?,good
Do you prefer online shopping?,good
Do you prefer orange juice for your breakfast?,good
Do you prefer oysters or snails?,good
Do you prefer pale or tanned skin?,good
Do you prefer paperback or hardcover?,good
Do you prefer questions boyfriend?,good
Do you prefer questions kids?,good
Do you prefer questions list?,good
Do you prefer questions?,good
Do you prefer red or green grapes?,good
