words_en,ratings
I'm really itchy everywhere.,good
I'm really itchy everywhere.,good
I'm really itchy.,good
I'm really lazy.,good
I'm really lonely.,good
I'm really looking forward to hearing from you.,good
I'm really looking forward to seeing you.,good
I'm really looking forward to working with you.,good
I'm really lost.,good
I'm really mad.,good
I'm really messy.,good
I'm really missing you.,good
I'm really obese.,good
I'm really obliged to you.,good
I'm really open mouthed.,good
I'm really open mouthed.,good
I'm really out of shape.,good
I'm really out of shape.,good
I'm really overweight.,good
I'm really overwhelmed.,good
I'm really pale how can I tan.,good
I'm really pale.,good
I'm really paranoid.,good
I'm really pissed off.,good
I'm really pleased.,good
I'm really popular.,good
I'm really pretty.,good
I'm really proud of you.,good
I'm really proud of you.,good
I'm really quiet in school.,good
I'm really really bored.,good
I'm really really concentrating.,good
I'm really really hot.,good
I'm really really lonely.,good
I'm really really ridiculously good looking.,good
I'm really really sad.,good
I'm really really sorry.,good
I'm really really tired.,good
I'm really thankful to you.,good
I'm really thankful to you.,good
I'm really thankful.,good
I'm really thin.,good
I'm really thirsty.,good
I'm really tired when I wake up.,good
"I'm really tired, but I can't sleep.",good
I'm really touched.,good
I'm really ugly and fat.,good
I'm really ugly.,good
I'm really underweight.,good
I'm really unfit.,good
I'm really unhappy with my life.,good
I'm really unhappy.,good
I'm really upset right now.,good
I'm really very happy for you.,good
I'm really very sad.,good
I'm really weak.,good
I'm really weird.,good
I'm really white.,good
I'm really worried.,good
I'm relieved to hear that you are well.,good
I'm resentful,excellent
I'm right,bad
I'm scared because I feel like I might not be up to it.,good
I'm sick of it,bad
"I'm sick of it, we always do the same thing.",bad
I'm sick of this shit,bad
I'm sick of you,violent
I'm sick of you,very violent
"I'm sick to my stomach, I need to do the big commute.",good
I'm skeptical,good
I'm smitten with you.,good
"I'm so far ahead of you, you big jerk.",very violent
I'm so happy I met you,good
I'm so sick of you,violent
I'm so sick of you....,violent
I'm so worthless!,violent
I'm sorry about that.,good
I'm sorry for what happened to you.,good
I'm sorry you feel that way,bad
"I'm sorry, it was my mistake.",good
I'm sorry.,good
I'm sorry.,good
"I'm starting to see through you, you dirty crook.",very violent
I'm still the bad guy,bad
I'm stronger than you,bad
I'm stunned,excellent
I'm surprised,excellent
I'm surprised by the fact that the system predicted the right answer at each try.,good
"I'm taking my license tomorrow, I feel very nervous.",excellent
I'm terrified,good
I'm terrified of what might happen.,good
I'm the asshole of choice,bad
I'm the bad guy,bad
I'm the happiest when you make me laugh.,good
I'm the last of the jerks,very violent
I'm the one who decides,bad
I'm the stooge,bad
"I'm the victim here, not you.",bad
I'm tired of all the rooms with your dirty things and baskets I'm not a dog.,bad
I'm tired of all this nonsense,bad
"I'm tired of being exploited, I'm always the one doing everything.",bad
I'm tired of being pushed around.,acceptable negative
I'm tired of doing all the machines and all the laundry,bad
I'm tired of hearing you complain about everything all the time.,bad
I'm tired of listening to you complain all day long.,bad
I'm tired of you,very violent
I'm tired of you being so loud.,bad
I'm too nice to you,very violent
I'm too scared to do it in a public place.,good
I'm too smart to be understood.,bad
I'm totally down with you.,good
I'm treated like an undesirable.,bad
I'm trying to break your heart.,good
I'm trying to call my family.,good
I'm trying to call you.,good
I'm trying to conceive my tips.,good
I'm trying to conceive.,good
"I'm trying to connect things together, can you tell me more?",excellent
"I'm trying to connect with your feelings, can I ask you a question?",excellent
I'm trying to contact you.,good
I'm trying to describe about that girl.,good
I'm trying to disappear.,good
I'm trying to do a job.,good
I'm trying to download adobe flash player.,good
I'm trying to drown out all of this noise.,good
I'm trying to eat healthy.,good
I'm trying to eat healthy.,good
I'm trying to eat your sandwich.,good
I'm trying to educate myself.,good
I'm trying to enjoy my dinner.,good
I'm trying to enjoy my lunch.,good
I'm trying to evoke.,good
I'm trying to explain myself.,good
I'm trying to find a book.,good
I'm trying to find my dad.,good
I'm trying to find someone.,good
I'm trying to get a job.,good
I'm trying to get pregnant.,good
I'm trying to grow my hair out.,good
I'm trying to have a baby.,good
I'm trying to heal your heart.,good
I'm trying to hear your heart.,good
I'm trying to help.,good
I'm trying to install Kespersky. (Software),good
I'm trying to learn English.,good
I'm trying to learn in french.,good
I'm trying to learn Japanese.,good
I'm trying to lose weight.,good
I'm trying to move on.,good
I'm trying to overcome.,good
I'm trying to prevent anyone saying.,good
I'm trying to quit dipping.,good
I'm trying to quit smoking.,good
I'm trying to reach you.,good
I'm trying to romance you.,good
I'm trying to say what I want to.,good
I'm trying to stop smoking.,good
I'm trying to take your cash.,good
I'm trying to tell you.,good
I'm trying to think.,good
I'm trying to understand how to walk this weary land.,good
I'm trying to understand the emotions you felt,excellent
I'm trying to understand.,good
I'm trying to update my iPhone.,good
I'm trying to use the phone.,good
I'm trying to wake your heart.,good
I'm trying to write a book.,good
I'm trying to write a song.,good
I'm uncomfortable because I don't know anyone here and I would have liked to be accepted when I entered the room.,excellent
I'm under your spell.,good
I'm unhappy with the way I play.,good
I'm upset about the incident this morning.,good
I'm upset to hear this news.,good
I'm useless,bad
I'm very angry with you.,good
I'm very angry.,good
I'm very appreciated for your help.,good
I'm very bored.,good
I'm very bothered.,good
I'm very busy.,good
I'm very clumsy.,good
I'm very cold.,good
I'm very competitive.,good
I'm very concerned about you.,good
I'm very concerned.,good
I'm very confident.,good
I'm very confused.,good
I'm very conscious that I am not wise at all.,good
I'm very constipated.,good
I'm very curious.,good
I'm very delighted.,good
I'm very depressed.,good
I'm very disappointed with you.,good
I'm very dizzy.,good
I'm very drunk.,good
I'm very emotional lately.,good
I'm very enthusiastic.,good
I'm very excited.,good
I'm very exciting.,good
I'm very far.,good
I'm very flattered.,good
I'm very fond of you.,good
I'm very frustrated.,good
I'm very glad to hear from you.,good
I'm very glad.,good
I'm very grateful for your help.,good
I'm very grateful to you.,good
I'm very grateful.,good
I'm very happy that you like it.,good
I'm very happy to hear that.,good
I'm very happy to meet you.,good
I'm very happy with you.,good
I'm very happy.,good
I'm very honored.,good
I'm very insecure.,good
I'm very interested in the position.,good
I'm very interested in this job.,good
I'm very interested.,good
I'm very jealous.,good
I'm very keen on working.,good
I'm very keen to learn.,good
I'm very keen to start.,good
I'm very keen.,good
I'm very kind of you.,good
I'm very knowledgeable.,good
I'm very lazy.,good
I'm very lazy.,good
I'm very lonely.,good
I'm very much appreciated.,good
I'm very much grateful to you.,good
I'm very much grateful.,good
I'm very much interested.,good
I'm very much looking forward.,good
I'm very much obliged.,good
I'm very negative.,good
I'm very nervous.,good
I'm very nice.,good
I'm very obliged to you.,good
I'm very obliged.,good
I'm very observant.,good
I'm very opinionated.,good
I'm very optimistic.,good
I'm very organized.,good
I'm very patient.,good
I'm very pleased to hear from you.,good
I'm very pleased to hear that.,good
I'm very pleased.,good
I'm very poor in English.,good
I'm very positive.,good
I'm very quiet and shy.,good
I'm very quit.,good
I'm very reserved.,good
I'm very resourceful.,good
I'm very responsible.,good
I'm very restless.,good
I'm very rich.,good
I'm very sad.,good
I'm very satisfied.,good
I'm very sorry for that.,good
I'm very sorry for the inconvenience.,good
I'm very sorry for the late reply.,good
I'm very sorry to bother you again.,good
I'm very sorry.,good
I'm very thankful to you.,good
I'm very thankful.,good
I'm very tired.,good
I'm very ugly.,good
I'm very unattractive.,good
I'm very unfit.,good
I'm very unhappy right now.,good
I'm very unlucky.,good
I'm very upset today.,good
I'm very upset.,good
I'm very very sad.,good
I'm very well in french.,good
I'm very well indeed!,good
I'm very well thank you.,good
I'm very well.,good
I'm very well. thank you.,good
I'm very willing to learn new things.,good
I'm very willing to.,good
I'm very worry about you.,good
I'm wanted.,bad
"I'm warning you, you're not going to keep treating me like this for long...",violent
I'm wetting like crazy.,good
I'm worried about the fact that I've been sleeping only 3 hours a night for three days.,good
I'm worried about the outcome of these negotiations,good
I'm worried that someone broke into your house.,good
I'm writing to thank you for the hard work you've dedicated to the project.,good
I'm writing to thank you for the incredibly positive tone you've set for me this week.,acceptable positive
"In 25 games, I haven't seen you score a single goal.",good
in fact I'm bored,very violent
"In fact, I am totally incompetent.",violent
"In fact, what you want is for me to leave...",violent
"In my house, I usually make dinner at 6:00 pm.",good
"In other words, they live on the land and in the water.",good
"In our country, people like you are stoned to death",very violent
"In reply to your email, here are the files.",good
"In the end, I felt like I ate too much.",good
"In the interest of getting back to you promptly, could you help me understand exactly what you’d like me to assist with?",good
"In the last week or so, I have noticed more often that you tap your pen on the desk.",good
"In the morning, will you check to see if the box is in his bag?",excellent
In the mountains I feel in harmony with nature.,good
In this outfit I feel comfortable and relaxed.,good
"In this story, you're the one who's wrong...",bad
"In you, I have found my soulmate.",good
In your last crisis,bad
Integrity is a core value for me.,good
Is it appropriate for me to provide you with a written document detailing the offer?,good
Is there a reason why we’ve always done it that way?,good
Is there any piece of this that still feels unfinished?,good
"Is there anything that prevents you from doing what I have asked you to do? Are you...(surprised, angry, upset, disappointed, etc.) by what I have just said? And now, what is going on inside you?",good
It also meets my need for supportive community and family relation.,good
It amazes me,good
It appears that I have a need to connect with others.,good
It appears that I need stimulation.,good
It can't be easy for you to hear these words? Does what I said mean anything to you?,good
it can't be true,bad
It ends with us.,good
"It evokes a need for gratitude, is that it?",good
it feeds my need to belong,excellent
It felt so good to be home.,good
it goes over your head,bad
It happened yesterday.,good
It has not been done,good
It hurts me when you don’t clean up your room correctly.,bad
It hurts Mommy and Daddy when you get poor grades at school.,violent
It is a city car,good
It is a sacred mountain that you are going to desecrate with your evil machines.,bad
It is appropriate for me to kiss each other on these occasions.,good
It is appropriate for me to take the time to express my gratitude.,good
It is because of the full moon that I behave badly,bad
it is bullshit,very violent
it is essential for me to feel confident,good
It is essential for me to have the choice.,good
It is essential for me to take time to grieve.,good
It is frustrating when you come late.,bad
It is going to be a shame if you don’t show up.,bad
It is important for me to have compassion for myself.,good
it is important for me to make sure that I am understood,good
It is important to me that my opinions are respected.,good
"It is midnight and I feel tired, I would like to go home and rest.",good
It is my fault that my parents could not love me.,bad
It is necessary for me to know that I can find food and drink.,good
It is nice for me to feel so much generosity.,good
"It is not important, it is only a pen!",bad
It is not interesting,bad
It is not interesting,bad
It is not necessary to be exhaustive,good
It is pertienent for me to read this book.,good
It is right for me to express gratitude to those who have helped me.,good
it is shit,very violent
It is useless.,violent
It is valuable for me to have simple and effective tools.,good
it is very important to me,good
"It is very likely that the professor will teach from home for a few days, if not the week.",good
It is wrong.,bad
It looks like a teenager,bad
It makes my heart melt watching you take care of our baby.,good
It makes sense to me to have a mutual exchange.,good
"It may not be your intention, but I feel like I'm being attacked.",good
It only proves you are an amateur,very violent
It rains a lot in winter.,good
It rains every afternoon in the hot season.,good
It rains.,good
It really impressed me when you…,good
It really infuriates me when spelling mistakes appear in our public brochures.,good
It seems that you are foolish.,very violent
It should be a lesson to you,violent
It snows a lot in winter over there.,good
It sounds like you are exasperated,good
It stinks of mouth the book that you make us read teacher.,bad
It was my first experience with a girl.,good
It was so cool when we had sex in the tent...,good
it will allow us to improve your behavior,bad
It will never change,bad
It works very well.,good
It would be cool to have a good laugh together.,good
It would be great for me if I could help.,good
It would be great if I could strengthen my skills while having fun.,good
It would be great to have a good laugh.,good
It would make me laugh a lot to see you dressed as a woman.,good
It’s all in the past.,good
It’s none of your business!,bad
"It’s not your fault, it's him.",bad
It'll do you good to get your ass kicked,violent
It's 8pm and dinner isn't ready,good
It's a beautiful day outside.,good
It's a cage of fools here,very violent
It's a concept we've already encountered twice.,good
It's a form of mutual respect that I particularly like.,excellent
It's a full moon,good
It's a good thing the others sucked or we would never have won.,bad
It's a hot topic that you're not fit to deal with.,bad
It's a kind of personal space that I'm particularly fond of.,excellent
It's a lot of nonsense,bad
It's a lot of nonsense,violent
It's a lovely day!,good
"It's a mess because you are messy, that's all.",bad
it's a pigsty,bad
It's a pleasure working with you!,good
It's a real mania with you,bad
it's a scandal,bad
It's a way of doing things that I like.,good
It's a wonderful evening.,good
it's all a show,bad
It's all bullshit,bad
It's all in your head,bad
It's all in your head...,bad
it's all nonsense,bad
It's all your fault,bad
it's all your fault,bad
it's always me who does everything,bad
it's always messy,bad
it's always my fault,bad
it's always my fault if I listen to you,bad
it's always the same,bad
It's always the same,bad
It's always the same people who take advantage,bad
it's always the same story,bad
It's always the same story with you,bad
"It's always the same story, you are never comptempted.",bad
it's always the same with you,bad
It's always you who is right,bad
It's amazing how clumsy you are.,violent
it's an admission of defeat,violent
It's an awful pigsty here!,bad
It's an unmistakable mess,bad
It's anoying to see how timid you are.,bad
it's awful,bad
it's because of you,bad
"It's been a week that you have to tidy up, it's an unspeakable mess",bad
It's been a while.,good
"It's been raining for 3 days, I feel down.",excellent
"It's been two months since we've had sex, I feel frustrated because I need sex.",excellent
It's been two months since you called me. ,good
It's better to be deaf than to listen to you,violent
It's better to sweep it all under the rug,bad
It's beyond you,violent
It's boring when you do that,bad
it's clear that you're not the one who's in charge,bad
it's disgusting,violent
It's disgusting to say such things.,bad
It's enough to be horrified when we see your face...,very violent
It's essential for me to be clear.,good
it's even worse,bad
It's for your own good,violent
It's glad to see you.,good
It's gonna end badly,bad
it's gonna get ugly,bad
It's helpful to have someone who has had experience with similar issues on previous projects to talk things over with. ,good
it's her or me,bad
It's hot all of a sudden...,good
It's imperative for me to take the time to discern.,good
It's important for me to have my routines.,excellent
It's important to me,good
It's impossible to agree with you,bad
it's in your head,bad
It's in your nature to do things wrong,violent
it's just horrible,bad
it's like you're giving me an ultimatum,bad
It's my brother's fault that we screwed up.,bad
it's my fault again,bad
it's my fault again,bad
It's my job that makes me do it,bad
It's nice to meet you.,good
it's no big deal,bad
"It's no big deal, you just have to do what I say.",bad
it's no picnic,bad
"It's not a carefree world here, either you get off your ass or you get out.",very violent
It's not for people like you,violent
it's not for you,bad
it's not going to happen like this,bad
It's not good to play music that loud at night,bad
it's not in your line,bad
it's not like I didn't tell you,bad
It's not like you do this,bad
it's not like you understand me,bad
"It's not logical, it doesn't make sense.",bad
it's not my fault,bad
it's not my fault I did it,bad
It's not my fault that I have this personality,bad
"It's not my fault we lost, it's the others who sucked.",violent
it's not my fault you don't understand,bad
it's not possible,bad
It's not possible for a guy as dumb as you,very violent
it's not that complicated,bad
it's not that complicated,bad
it's not that difficult,bad
it's not the way to get there,bad
It's not true,bad
It's not your fault you're incompetent,bad
it's not your problem,bad
It's obvious it's not you,bad
"It's ok, you need to calm down...",bad
"it's okay, just let it go",bad
"it's okay, we get it",bad
It's only a matter of time before you betray me.,bad
It's paranoia,bad
It's pretty good.,good
It's raining like crazy.,good
It's really a piece of shit thing,very violent
It's really boring to listen to you talk,very violent
it's shameful,violent
It's something important to me,excellent
it's still my fault,bad
It's still pretty incredible,bad
it's still your fault,violent
It's such a beautiful day!,good
It's such a lovely day!,good
It's such a warm day!,good
"It's the first time I'm doing a cunulilingus to a girl, can you guide me?",good
"It's the first time I've walked in such high heels, I feel insecure.",good
It's the one who says it is,bad
It's the pot calling the kettle black,bad
It's too complicated,bad
it's too complicated for you,bad
It's too late,bad
It's totally stupid,very violent
"It's true that in your family of alcoholic inbreds, it's hard to understand.",very violent
It's unbelievable this constant anger,bad
It's up to you to change,bad
It's up to you to decide when you're ready,good
It's urgent for me to get care.,good
It's vital for me to stay well hydrated in this heat.,good
it's you again,bad
It's you who misunderstood me,bad
it's your fault,bad
It's your fault we lost.,violent
it's your pessimistic side,bad
I've already made a huge effort,bad
I've become transparent to you,bad
I've been better.,good
"I've been listening to you talk about your parents for 3 hours, I'd like to talk to you about my problems too.",good
I've been waiting far too long.,bad
I've gained 3Kg since last month,good
I've got a crush on you.,good
I've got a revenge to take,very violent
I've got a thing for you.,good
I've got one hell of a boner.,good
I've got to win even if it means crushing others,violent
I've heard a lot of bad things about you,violent
I've heard you don't know how to do it,bad
I've never met a leading actor who's so tight!,very violent
I've never seen anyone with such a catastrophic potty mouth as yours.,very violent
I've organized a sex toy meeting with some girlfriends...,good
I've totally fallen for you.,good
John cannot sleep without sleeping pill anymore.,good
Juliana can't pretend anymore.,good
Just a note to say that we were selected this year.,good
"Just as I was watching the football match on TV, electricity went off.",good
"Just before the presidential election, the media put forward the subject of insecurity, which helped to elect the right.",good
Just forget about it now,good
Just quit,very violent
Just to update you on the current project status.,good
Just wanted to thank you for being you.,good
Just writing to confirm our arrangement.,good
Keep it up and I'll smash your face against the wall,very violent
Keep it up and thank you once again!,good
"Keep the good work going, and, thank you once again.",good
Keep up the excellent work!,good
kill yourself,very violent
Kind regards,good
King Kong and Godzilla destroyed the city while they were fighting. ,good
Know where you stand,bad
Last night I get woken up by the sound of a barking dog across the street.,good
Last night I was tired and in a bad mood.,good
Last night our son cried for an hour and I felt helpless.,excellent
Last night some students played loud music and I felt very upset because I need to rest.,excellent
"Last night, she bit her nails while watching TV.",good
"Last night, the noise of the slamming doors woke me up.",good
Last time there was no appointment available for a month,good
"Last week, you promised to hold the job for me.",good
"Leanne, the maid of honor from my wedding, is coming over this weekend.",good
Learning that it was a quid pro quo made me feel better.,good
leave me alone,bad
"Leave me alone, fuckface",very violent
Let go of my leg!,bad
Let it go already,good
Let me know if I can help you further.,good
Let me know if you need anything else.,good
Let me see if I understand this.,good
Let’s get a coffee sometime.,good
Let’s grab lunch.,good
Let’s start over from square one.,good
Let's agree to disagree since you cannot question yourself.,bad
Let's get it on.,good
Let's go have sex in the hot tub...,good
Let's not talk about it,bad
let's say you have room for improvement,violent
Let's sit down and think about it together,good
let's stop here,bad
Let's talk about your lack of skills,violent
Let's try to calm down,good
Let's try to take a step back,good
"Liar, thief, ingrate...",very violent
"Liar, you're such a liar.",bad
Lick me.,good
Life is not for the weak,bad
"Light travels at almost 300,000 kilometres per second.",good
like it deserves this,bad
Like the chick has a brain,very violent
Like you say you're in charge but you're just a blowhard...,bad
"Listen to me, you are just a toy.",very violent
"Listen, get in line to lick my ass",very violent
Little dick,very violent
Long time no see.,good
Long time no talk.,good
Look at you,very violent
look at yourself in the mirror,bad
"Look, a young kid like you doesn't understand.",bad
Looking forward to hearing from you.,good
Looking forward to seeing you.,good
Lower your eyes,bad
Luckily I'm behind you,bad
Luckily I'm better than you in there,bad
Lucky I'm here,bad
Lying is wrong and you are a bad kid.,bad
"M. Little suggests The Gordon Model for Effective Relationships (1970) as a likely precursor to both NVC and interest-based negotiation, based on conceptual similarities, if not any direct evidence of a connection.",good
Make us cry while you're at it,bad
Make us cry while you're at it...,bad
May I come in?,good
May I have another hamburger?,good
May I see your insurance card?,good
"Maybe that’s what you heard in your head, but it’s not what I said.",bad
Maybe you think I can't?,bad
maybe you think I'm exaggerating,bad
Maybe you think that everything is permited?,violent
Maybe you think you're right again?,bad
Maybe you want me to answer to you?,bad
Maybe you're just a psycho.,bad
Meeting you was the best thing that’s ever happened to me.,good
"Mommy feels disappointed when you don’t finish your food, because I want you to grow up strong and healthy.",good
Mommy is disappointed when you don’t finish your food.,bad
"Moreover, the results of a recent piece of research provide compelling evidence in support of the main hypothesis.",good
Motherfucker,very violent
Murderer,very violent
"My answer was wrong, because I didn't spot the trap.",excellent
My baby has a rash on his legs and won’t stop scratching it.,good
My behavior is in reaction to yours,bad
My book is torn,good
My boss is unreasonable; he always expects so much out of me.,bad
"My brother bought spray paint, which he used to cover up the graffiti.",good
